{
  "version": "1.0.0",
  "generatedAt": "2026-06-26T13:07:52.493Z",
  "site": {
    "title": "我的时光纪",
    "author": "张三",
    "description": "记录生命中的重要时刻"
  },
  "stages": [
    {
      "id": "childhood-1998-2010",
      "name": "童年时光",
      "type": "education",
      "startDate": "1998-01-01",
      "endDate": "2010-06-30",
      "cover": "/img/01-childhood/01-childhood-001.jpg",
      "themeColor": "#F2A65A",
      "locations": [
        "北京"
      ],
      "people": [
        "mom",
        "dad"
      ],
      "tags": [
        "成长",
        "家庭"
      ],
      "description": "在北京度过的童年，胡同里的夏天与冰糖葫芦。",
      "content": "/data/stages/01-childhood.md",
      "albumIds": [],
      "photoIds": [
        "01-childhood-001",
        "01-childhood-002",
        "01-childhood-003"
      ]
    },
    {
      "id": "university-2015-2019",
      "name": "大学四年",
      "type": "education",
      "startDate": "2015-09-01",
      "endDate": "2019-06-30",
      "cover": "/img/02-university/02-university-001.jpg",
      "themeColor": "#4A90D9",
      "locations": [
        "武汉"
      ],
      "people": [
        "alice",
        "mom"
      ],
      "tags": [
        "青春",
        "友谊",
        "成长"
      ],
      "description": "武汉的大学四年，东湖骑行与樱花季。",
      "content": "/data/stages/02-university.md",
      "albumIds": [],
      "photoIds": [
        "02-university-001",
        "02-university-002",
        "02-university-003",
        "02-university-004"
      ]
    },
    {
      "id": "first-job-2020-2022",
      "name": "初入职场",
      "type": "career",
      "startDate": "2020-07-01",
      "endDate": "2022-12-31",
      "cover": "/img/03-first-job/03-first-job-001.jpg",
      "themeColor": "#E0564D",
      "locations": [
        "深圳"
      ],
      "people": [
        "bob"
      ],
      "tags": [
        "职场",
        "独立"
      ],
      "description": "深圳的第一份工作，从生涩到独当一面。",
      "content": "/data/stages/03-first-job.md",
      "albumIds": [
        "2020-summer-sanya"
      ],
      "photoIds": [
        "03-first-job-001",
        "03-first-job-002",
        "03-first-job-003"
      ]
    }
  ],
  "albums": [
    {
      "id": "2020-summer-sanya",
      "title": "2020 夏日海岛行",
      "date": "2020-08-15",
      "stageId": "first-job-2020-2022",
      "location": {
        "latitude": 18.2528,
        "longitude": 109.5119,
        "name": "三亚"
      },
      "people": [
        "alice"
      ],
      "cover": "/img/2020-summer-sanya/2020-summer-sanya-001.jpg",
      "content": "/data/albums/2020-summer-sanya.md",
      "photoIds": [
        "2020-summer-sanya-001",
        "2020-summer-sanya-002",
        "2020-summer-sanya-003"
      ]
    }
  ],
  "people": [
    {
      "id": "alice",
      "name": "Alice",
      "avatar": "",
      "bio": "大学室友，四年形影不离。",
      "stageIds": [
        "university-2015-2019"
      ],
      "content": "/data/people/alice.md"
    },
    {
      "id": "bob",
      "name": "Bob",
      "avatar": "",
      "bio": "第一份工作的前辈与好友。",
      "stageIds": [
        "first-job-2020-2022"
      ],
      "content": "/data/people/bob.md"
    },
    {
      "id": "dad",
      "name": "爸爸",
      "avatar": "",
      "bio": "沉默而坚定的依靠。",
      "stageIds": [
        "childhood-1998-2010"
      ],
      "content": "/data/people/dad.md"
    },
    {
      "id": "mom",
      "name": "妈妈",
      "avatar": "",
      "bio": "最温暖的后盾。",
      "stageIds": [
        "childhood-1998-2010",
        "university-2015-2019"
      ],
      "content": "/data/people/mom.md"
    }
  ],
  "places": [
    {
      "id": "beijing",
      "name": "北京",
      "location": {
        "latitude": 39.9042,
        "longitude": 116.4074,
        "name": "北京"
      },
      "stageIds": [
        "childhood-1998-2010"
      ],
      "photoIds": [
        "01-childhood-001",
        "01-childhood-002",
        "01-childhood-003"
      ],
      "content": "/data/places/beijing.md"
    },
    {
      "id": "sanya",
      "name": "三亚",
      "location": {
        "latitude": 18.2528,
        "longitude": 109.5119,
        "name": "三亚"
      },
      "stageIds": [],
      "photoIds": [
        "2020-summer-sanya-001",
        "2020-summer-sanya-002",
        "2020-summer-sanya-003"
      ],
      "content": "/data/places/sanya.md"
    },
    {
      "id": "shenzhen",
      "name": "深圳",
      "location": {
        "latitude": 22.5431,
        "longitude": 114.0579,
        "name": "深圳"
      },
      "stageIds": [
        "first-job-2020-2022"
      ],
      "photoIds": [
        "03-first-job-001",
        "03-first-job-002",
        "03-first-job-003"
      ],
      "content": "/data/places/shenzhen.md"
    },
    {
      "id": "wuhan",
      "name": "武汉",
      "location": {
        "latitude": 30.5928,
        "longitude": 114.3055,
        "name": "武汉"
      },
      "stageIds": [
        "university-2015-2019"
      ],
      "photoIds": [
        "02-university-001",
        "02-university-002",
        "02-university-003",
        "02-university-004"
      ],
      "content": "/data/places/wuhan.md"
    }
  ],
  "photos": [
    {
      "id": "01-childhood-001",
      "src": "/img/01-childhood/01-childhood-001.jpg",
      "thumbnail": "/img/01-childhood/thumbs/01-childhood-001.jpg",
      "caption": "",
      "date": "2006-01-15T10:00:00",
      "stageId": "childhood-1998-2010",
      "width": 800,
      "height": 600,
      "location": {
        "latitude": 39.9,
        "longitude": 116.4,
        "name": "北京"
      }
    },
    {
      "id": "01-childhood-002",
      "src": "/img/01-childhood/01-childhood-002.jpg",
      "thumbnail": "/img/01-childhood/thumbs/01-childhood-002.jpg",
      "caption": "",
      "date": "2008-05-03T09:15:00",
      "stageId": "childhood-1998-2010",
      "width": 800,
      "height": 600,
      "location": {
        "latitude": 39.9,
        "longitude": 116.4,
        "name": "北京"
      }
    },
    {
      "id": "01-childhood-003",
      "src": "/img/01-childhood/01-childhood-003.jpg",
      "thumbnail": "/img/01-childhood/thumbs/01-childhood-003.jpg",
      "caption": "",
      "date": "2005-07-20T14:30:00",
      "stageId": "childhood-1998-2010",
      "width": 800,
      "height": 600,
      "location": {
        "latitude": 39.9,
        "longitude": 116.4,
        "name": "北京"
      }
    },
    {
      "id": "02-university-001",
      "src": "/img/02-university/02-university-001.jpg",
      "thumbnail": "/img/02-university/thumbs/02-university-001.jpg",
      "caption": "",
      "date": "2016-04-10T16:45:00",
      "stageId": "university-2015-2019",
      "width": 800,
      "height": 600,
      "location": {
        "latitude": 30.583333,
        "longitude": 114.3,
        "name": "武汉"
      }
    },
    {
      "id": "02-university-002",
      "src": "/img/02-university/02-university-002.jpg",
      "thumbnail": "/img/02-university/thumbs/02-university-002.jpg",
      "caption": "",
      "date": "2015-09-05T08:30:00",
      "stageId": "university-2015-2019",
      "width": 800,
      "height": 600,
      "location": {
        "latitude": 30.583333,
        "longitude": 114.3,
        "name": "武汉"
      }
    },
    {
      "id": "02-university-003",
      "src": "/img/02-university/02-university-003.jpg",
      "thumbnail": "/img/02-university/thumbs/02-university-003.jpg",
      "caption": "",
      "date": "2017-03-25T13:00:00",
      "stageId": "university-2015-2019",
      "width": 800,
      "height": 600,
      "location": {
        "latitude": 30.583333,
        "longitude": 114.3,
        "name": "武汉"
      }
    },
    {
      "id": "02-university-004",
      "src": "/img/02-university/02-university-004.jpg",
      "thumbnail": "/img/02-university/thumbs/02-university-004.jpg",
      "caption": "",
      "date": "2019-06-20T10:00:00",
      "stageId": "university-2015-2019",
      "width": 800,
      "height": 600,
      "location": {
        "latitude": 30.583333,
        "longitude": 114.3,
        "name": "武汉"
      }
    },
    {
      "id": "03-first-job-001",
      "src": "/img/03-first-job/03-first-job-001.jpg",
      "thumbnail": "/img/03-first-job/thumbs/03-first-job-001.jpg",
      "caption": "",
      "date": "2021-11-08T18:30:00",
      "stageId": "first-job-2020-2022",
      "width": 800,
      "height": 600,
      "location": {
        "latitude": 22.533333,
        "longitude": 114.05,
        "name": "深圳"
      }
    },
    {
      "id": "03-first-job-002",
      "src": "/img/03-first-job/03-first-job-002.jpg",
      "thumbnail": "/img/03-first-job/thumbs/03-first-job-002.jpg",
      "caption": "",
      "date": "2021-03-12T14:20:00",
      "stageId": "first-job-2020-2022",
      "width": 800,
      "height": 600,
      "location": {
        "latitude": 22.533333,
        "longitude": 114.05,
        "name": "深圳"
      }
    },
    {
      "id": "03-first-job-003",
      "src": "/img/03-first-job/03-first-job-003.jpg",
      "thumbnail": "/img/03-first-job/thumbs/03-first-job-003.jpg",
      "caption": "",
      "date": "2020-07-01T09:00:00",
      "stageId": "first-job-2020-2022",
      "width": 800,
      "height": 600,
      "location": {
        "latitude": 22.533333,
        "longitude": 114.05,
        "name": "深圳"
      }
    },
    {
      "id": "2020-summer-sanya-001",
      "src": "/img/2020-summer-sanya/2020-summer-sanya-001.jpg",
      "thumbnail": "/img/2020-summer-sanya/thumbs/2020-summer-sanya-001.jpg",
      "caption": "",
      "date": "2020-08-15T18:45:00",
      "stageId": "first-job-2020-2022",
      "albumId": "2020-summer-sanya",
      "width": 800,
      "height": 600,
      "location": {
        "latitude": 18.25,
        "longitude": 109.5,
        "name": "三亚"
      }
    },
    {
      "id": "2020-summer-sanya-002",
      "src": "/img/2020-summer-sanya/2020-summer-sanya-002.jpg",
      "thumbnail": "/img/2020-summer-sanya/thumbs/2020-summer-sanya-002.jpg",
      "caption": "",
      "date": "2020-08-15T16:00:00",